{
  "$schema": "https://raw.githubusercontent.com/Cheerpipe/Open-Brew-by-Weight/main/docs/schemas/openbrewbyweight-shot-export-v2.schema.json",
  "format": "openbrewbyweight.shots",
  "version": 2,
  "exportedAt": "2026-10-24T11:20:00.000Z",
  "source": {
    "app": "openbrewbyweight",
    "firmwareVersion": "1.0.0",
    "host": "openbrew-kitchen.local"
  },
  "shots": [
    {
      "id": 412,
      "bootId": 37,
      "time": {
        "startedAt": "2026-10-24T08:12:15-03:00",
        "endedAt": "2026-10-24T08:12:44-03:00",
        "utcOffsetMinutes": -180,
        "endedAtUptimeMs": 523311
      },
      "type": "auto",
      "rating": 4,
      "preset": {
        "id": 3,
        "name": "Daily"
      },
      "scale": {
        "name": "Lunar"
      },
      "recipe": {
        "targetYieldG": 36,
        "doseG": 18,
        "targetTemperatureC": 93
      },
      "outcome": {
        "durationS": 28.4,
        "yieldG": 36.31,
        "yieldSource": "post_drip",
        "estimatedYieldG": null,
        "ratio": 2.02,
        "averageFlowGS": 1.62,
        "firstDropS": 6.1,
        "tareS": null,
        "arrivalS": 27.9,
        "verdict": "on_recipe",
        "channeling": false
      },
      "stop": {
        "cut": "auto",
        "reason": "normal_target",
        "cutLineG": 35.3,
        "scaleLossSource": null,
        "blind": false
      },
      "control": {
        "brewByWeight": {
          "algorithm": "corridor",
          "algorithmVersion": 1,
          "alpha": 0.35,
          "learningApplied": true,
          "offsetG": 1.8
        },
        "window": {
          "fastBeforeS": 25,
          "slowAfterS": 33
        },
        "fastGuard": {
          "enabled": true,
          "marginG": 2,
          "extended": false
        },
        "slowGuard": {
          "enabled": true,
          "marginG": 2,
          "extended": false
        },
        "cutDelayS": 0.4,
        "fastRampS": 0,
        "slowRampS": 4,
        "fastCurve": "even",
        "slowCurve": "late",
        "fastCurveHardness": "soft",
        "slowCurveHardness": "hard",
        "maxTimeS": 45,
        "dripDelayS": 3
      },
      "curve": {
        "truncated": false,
        "timeS": [
          0.2, 1.2, 2.2, 3.2, 4.2, 5.2, 6.2, 7.2, 8.2, 9.2, 10.2, 11.2, 12.2, 13.2, 14.2, 15.2,
          16.2, 17.2, 18.2, 19.2, 20.2, 21.2, 22.2, 23.2, 24.2, 25.2, 26.2, 27.2, 28.2, 29.2, 30.2
        ],
        "weightG": [
          0, 0, 0, 0, 0, 0, 0.07, 0.7, 1.7, 2.95, 4.36, 5.9, 7.5, 9.16, 10.85, 12.56, 14.29, 16.03,
          17.78, 19.53, 21.28, 23.04, 24.8, 26.55, 28.31, 30.07, 31.83, 33.59, 35.35, 36.07, 36.31
        ],
        "heldIndices": [],
        "gapBeforeIndices": [],
        "events": {
          "firstDrop": {
            "atS": 6.1,
            "weightG": 0.2
          },
          "extended": null,
          "scaleLoss": null,
          "scaleLossClearedS": null,
          "end": {
            "atS": 28.4,
            "weightG": 35.35
          }
        }
      },
      "derived": {
        "flowGS": [
          null,
          null,
          null,
          null,
          null,
          null,
          null,
          0.63,
          1,
          1.25,
          1.41,
          1.54,
          1.6,
          1.66,
          1.69,
          1.71,
          1.73,
          1.74,
          1.75,
          1.75,
          1.75,
          1.76,
          1.76,
          1.75,
          1.76,
          1.76,
          1.76,
          1.76,
          1.76,
          0.72,
          0.24
        ],
        "maxFlowGS": 1.76,
        "errorVsTargetG": 0.31,
        "errorVsTargetPct": 0.86,
        "errorVsPlannedStopPct": 2.86,
        "cut": {
          "atS": 28.4,
          "weightG": 35.35
        },
        "dripG": 0.96
      }
    }
  ]
}
